[
  {
    "title": "单笔均量冲击因子",
    "hypothesis": "在1小时永续合约K线中，volume/count 反映单笔成交规模；当单笔均量相对自身近期水平出现异常抬升时，往往对应大单或机构拆单集中成交，短期价格可能沿成交方向延续，但过度冲击后易出现流动性回补带来的反转。",
    "data_sources": [
      "yhydev97/quant-data"
    ],
    "formula_sketch": "按 symbol、open_time 排序；avg_trade_size = volume / count；对每标的计算 avg_trade_size 的 24 期滚动均值与标准差；冲击 = (avg_trade_size - rolling_mean_24) / rolling_std_24；可选与当根收益率 sign(close/open - 1) 同号加权；横截面在同一 open_time 上对冲击值做 z-score 或分位排序。",
    "expected_signal": "横截面做多冲击适中且与价格方向一致的标的、做空冲击极端且价格已大幅偏离的标的；适用于多币种永续合约小时频轮动，可配合波动率或成交额过滤低流动性品种。",
    "risks": [
      "count 或 volume 接近 0 时单笔均量失真，需设最小成交额门槛",
      "新上市或低流动性 symbol 滚动统计不稳定",
      "1h 频率下大单可能跨多根K线分摊，冲击信号滞后",
      "横截面品种生命周期差异带来幸存者偏差"
    ]
  },
  {
    "title": "K线实体占比极值反转",
    "hypothesis": "实体占比 body_ratio = (close - open) / (high - low) 刻画单小时价格运动效率；当实体占比接近 ±1 时，说明价格单向推进且振幅被充分占用，短期情绪过热，在加密货币高波动环境下更可能出现小时级均值回归。",
    "data_sources": [
      "yhydev97/quant-data"
    ],
    "formula_sketch": "按 symbol 计算 body_ratio = (close - open) / (high - low)，当 high == low 时置 NaN 并剔除；对每标的取 body_ratio 的 48 期滚动分位数或 z-score；极值信号 = -sign(body_ratio) * abs(zscore(body_ratio))，即实体方向越强、越极端则反转得分越高；横截面在同一 open_time 按极值信号排序。",
    "expected_signal": "横截面做空 body_ratio 极高（强势阳线实体）品种、做多 body_ratio 极低（强势阴线实体）品种，预期下一小时收益反转；适用于高波动多币种小时频，可对 quote_volume 做流动性中性或分层检验。",
    "risks": [
      "high-low 极窄时 body_ratio 噪声大，需最小振幅过滤",
      "趋势行情中反转因子可能持续失效",
      "仅使用当根K线收盘价，需确保信号在 close_time 之后下单以避免 lookahead",
      "不同合约 tick 规则与最小价格变动影响实体占比可比性"
    ]
  }
]
