[
  {
    "title": "横截面低截面收益离散环境收位-收益排名反向裂口均值回归轮动",
    "hypothesis": "基于查询发现：2024-Q1 当截面收益标准差 cs_std_ret≤0.013（低离散，117836 条 Bar）时，CLV 排名处于前 20% 但同期收益排名处于后 20% 的标的，下一 Bar 平均收益 +0.134%；而在高离散环境（14696 条 Bar）同一模式平均收益为 -0.234%，方向反转。低离散时 CLV-收益 rank 裂口与下期收益 corr=-0.004，暗示收位领先于价格、存在截面均值回归溢价。",
    "data_sources": [
      "yhydev97/quant-data"
    ],
    "formula_sketch": "按 symbol 计算 ret=(close-open)/open、clv=(close-low)/(high-low)；每个 open_time 分组计算 cs_std_ret=STDDEV(ret)，clv_rank=PERCENT_RANK(clv)，ret_rank=PERCENT_RANK(ret)，gap=clv_rank-ret_rank；低离散掩码 cs_std_ret≤截面中位数或固定阈值 0.013；factor=gap 在低离散 Bar 上取 rank/z-score，高离散 Bar 置零或反向；每个 open_time 对 factor 做组内 rank 或 z-score 用于多空排序。",
    "expected_signal": "横截面：仅在低截面收益离散环境做多 gap 低分位（收位弱但收益强，预期回落）、做空 gap 高分位（收位强但收益弱，预期补涨）；高离散环境降权或反向；适合 1h 频率 crypto UM 截面轮动。",
    "risks": [
      "离散环境阈值需样本外校准，2021-Q2 高波阶段 symbol 仅 74 个，截面深度不足",
      "CLV 与 ret  contemporaneous 相关高达 0.599，裂口信号可能受同期共振污染",
      "低离散时段占比约 89%，因子暴露高度集中于平静市场"
    ]
  },
  {
    "title": "横截面前Bar高位锚开阴K下期延续轮动",
    "hypothesis": "基于查询发现：2024-Q1 当 open 位于前 Bar 区间 80% 分位以上（oip>0.8）且当期收阴（ret<0）时，下一 Bar 平均收益 -0.093%（14087 次）；对称地 oip<0.2 且收阳时下一 Bar 平均 +0.072%（12424 次）。高位锚定遇阴 K 的 reject_strength rank 与下期收益 corr=-0.025，说明前 Bar 区间上沿假突破后卖压延续，而非立即反弹。",
    "data_sources": [
      "yhydev97/quant-data"
    ],
    "formula_sketch": "按 symbol 计算 oip=(open-prev_low)/(prev_high-prev_low)、ret=(close-open)/open；bear_reject=CASE WHEN oip>0.8 AND ret<0 THEN oip*|ret| ELSE 0 END，bull_support=CASE WHEN oip<0.2 AND ret>0 THEN (1-oip)*ret ELSE 0 END；raw=bear_reject-bull_support；每个 open_time 对 raw 做组内 PERCENT_RANK 或 z-score，做多低分位（bull_support 强）、做空高分位（bear_reject 强）。",
    "expected_signal": "横截面：做空 bear_reject 排名靠前标的、做多 bull_support 排名靠前标的；预期 1h 持有期延续前 Bar 区间边界拒绝方向；适用于 183+ symbol 的 UM 永续截面。",
    "risks": [
      "与已有前 Bar 开盘分位锚定因子部分重叠，需检验增量 IC",
      "Trending 市场中高位阴 K 可能是正常回调而非假突破",
      "open 位于前 Bar 极端分位样本占比较高，需流动性过滤"
    ]
  },
  {
    "title": "单标的Quote量能翻倍后次Bar实现波动跃升",
    "hypothesis": "基于查询发现：2024-Q1 全样本当 quote_volume 较前 Bar 增幅>100%（qv_chg>1.0，12347 次）时，当期 |ret| 均值 1.715%，而量能下降时仅 0.647%（约 2.65 倍）；BTCUSDT 单标的 qv 翻倍后下一 Bar |ret| 均值 0.615% vs 量能下降 0.339%（n_dbl=91），高于全样本 baseline 0.376%。量能跃迁后波动抬升具有时序持续性，可捕捉事件驱动后的 gamma 暴露窗口。",
    "data_sources": [
      "yhydev97/quant-data"
    ],
    "formula_sketch": "按 symbol 时序计算 qv_chg=(quote_volume-LAG(quote_volume))/LAG(quote_volume)；signal=1{qv_chg>1.0} 或 qv_chg 本身；预测目标 LEAD(|ret|) 或 LEAD(rng)；可选与截面 rank 无关，直接在单 symbol 上做分位触发：当 signal 进入历史 90 分位时做多 straddle/波动率代理、或降低方向性仓位。",
    "expected_signal": "时序：quote 量能翻倍 Bar 的下一 1h 实现波动系统性高于常态（BTC 0.615% vs 0.339%）；适用于单标的 vol targeting、期权 gamma scalping 或 directional breakout 过滤；非横截面排序因子。",
    "risks": [
      "全市场 12347 次跃迁事件中部分伴随已大幅 price move，存在同期波动与预测波动混淆",
      "1h 频率下翻倍阈值对低流动性 altcoin 过于频繁",
      "跃升后波动均值回归速度未检验，持有窗口过 long 可能衰减"
    ]
  }
]
